"User","Comment","Rating","Date"
"seruanyre","So I recently watched ""The Avengers"" and let me tell you, it was lit. The action scenes were insane and the special effects were on point. But what really stood out to me was the chemistry between the characters, it was like they had been a team for years. I mean sure, As a huge fan, it was amazing to see them share the screen with all these other badass heroes. Overall, I highly recommend checking out ""The Avengers"" if you haven't already. Trust me, you won't regret it.The casting in Avengers is truly exceptional. Each actor effectively embodies their respective character, bringing them to life on screen. Chris Evans portraysals the role of Captain America with a sense of responsibility and gravitas, while Robert Downey Jr.'s portrayal of Tony Stark/Iron Man is both charming and entertaining. Mark Ruffalo, who plays the Hulk, brings a level of vulnerability and empathy to the character that has never been seen before. Chris Hemsworth, as Thor, seamlessly blends power and humor, and Scarlett Johansson's Black Widow is fierce and formidable. But perhaps the stand-out performance is Tom Hiddleston as Loki, who imbues the villain with a charm and intelligence that commands the audience's attention throughout the film.The story of Avengers: Endgame is expertly crafted, weaving together a diverse array of characters and plotlines from the Marvel Cinematic Universe in a cohesive and impactful manner. The film is packed with unforgettable moments, from the grandiose action sequences to the more intimate, emotional moments. The climax of the film is truly a sight to behold, bringing all the characters together in a thrilling and satisfying conclusion.Overall, The Avengers is a must-see film. It is a marvel of filmmaking and storytelling, and it will be recognized as one of the best superhero films of all time.","9","16 January 2023"
"dee.reid","As you well know by now, ""The Avengers"" is a large-scale superhero film that was four years in the making, with no less than four individual - yet inter-connected superhero films - feeding into this film's overall story. Joss ""Firefly"" Whedon was the director and co-writer on this highly ambitious project that is an adaptation of the Marvel Comics superhero team co-created by Stan Lee (who also appears in a very small cameo, like almost every other movie adaptation of a superhero he had a hand in creating) and the late Jack Kirby. Steve Rogers/Captain America (Chris Evans), Tony Stark/Iron Man (Robert Downey, Jr.), Bruce Banner/The Incredible Hulk (Mark Ruffalo), Thor (Chris Hemsworth), Natasha Romanoff/The Black Widow (Scarlet Johansson), and Clint Barton/Hawkeye (Jeremy Renner) are the six misfits chosen by Nick Fury, Agent of S.H.I.E.L.D. (Samuel L. Jackson) to defeat the traitorous Asgardian misfit Loki (Tom Hiddleston) and his alien army from laying waste to New York City. And of course, six characters usually accustomed to working alone have to work out their differences and come together as a team to save the world. What gets ""The Avengers"" many points is that beside its big action sequences, fights and special effects, we never really lose sight of the characters (who are usually relegated to the background in a movie like this) and who they are. I liked that the movie actually spent time developing the individual characters so that we get to know them all over again - even though they've all already appeared in previous superhero films. It's all big superhero fun, with a knowing wink and an outstanding sense of humor that manages to elicit some strong laughs from anyone viewing this thing with an open mind. Sit back and enjoy!10/10P.S.: What happened to Dr. Henry ""Hank"" Pym/Giant-Man and Janet van Dyne/The Wasp? Weren't they part of the original Avengers team line-up (before ""The Avengers #4"" when Captain America became team leader, marking the character's Silver Age debut)? This was my only real complaint about ""The Avengers.""","9","9 July 2012"
"francoischristana","It is shocking to me that Loki's personal resentment against Thor led to all of this destruction. For what reason did he believe that he would just take control and dictate Earth without any consequences? Earth is not at an advantage in battle, so Nick Fury had the right of using the Tesseract to create weaponry. It took some time to get everyone on the same page, but in the end, their shared goal inspired them to work together as a team, which is why I admired how the Avengers came together. I have never watched the Marvel series before, but now I am totally invested. I am curious to know since Loki did not keep his promises to the Chitauri what will happen next.","10","22 October 2023"
"brandon_lee420","Believe me when I say that 'The Avengers' was my most anticipated movie ever. I mean, come on, a bunch of superheroes gathering and fighting evil, that is just priceless. And not any superheroes but the most well-known and well-loved. The movie has some of the best actors in Hollywood portraying some of the best superheroes to have ever been created. This movie has loads of Captain America, Iron Man, Thor, Hawkeye, and, needless to say, Hulk Smash! They were all portrayed on screen brilliantly and I give thanks to the actor for making them feel awesome, cool, and really, really fun. I live in Australia and we get an earlier viewing of the film but for you Americans, this wait is is worth it. When the movie was over, most of the cinema clapped - this was the first time I had ever seen this ever at the movies. Even though it was 12 in the morning, the whole cinema was packed and all of them came out of the cinema satisfied and were glad they paid the $13 to watch it.The plot of the movie is straightforward but done magnificently. Loki, previously seen in Thor, wants to wreak havoc on Earth by letting a group of aliens enter Earth through a portal. It's up to the Avengers to stop him but first they have to solve the rivalries and bitterness between them. The fight scenes between the superheroes are just f*cking AWESOME! I was so excited to see Thor and Iron Man battle it out - that scene was just plain epic.The music and soundtrack in the movie was good and it did a nice job of alleviating the action, and trust me there is a LOT of action. The visual effects are also fantastic, one of the best I have ever seen in a film, and they will leave you in awe. Hulk, along with Iron Man, do a good job of adding humour into the film and ALL of the scenes with the Hulk left everyone at the cinemas laughing. It is pretty obvious that his squad mates think highly of him as seen in the scene where Stark and Loki have a confrontation ('We have an Army' , 'We have a Hulk'). That scene was what did it for me.If you guys are in doubt as to see this then let me assure you that you are gonna get the bang for your buck that you deserve. So far, it is one of the best superhero film made but of all time? Not really sure, guess we have to wait for TDKR to come out. 10/10 - Perfect! 'Over and Out.' 25 April 2012","10","24 April 2012"
"Allswell007","I just loved Marvel's Avengers. I thought it was smart and the impressive cast really delivered! This movie works on so many levels and makes you draw on just about all of your emotions. I don't remember when I enjoyed a movie this much! Such cool fantasy but what makes it extra special is following this film after all the other solo efforts from each character. I enjoyed the others films quite a bit but they all delivered something different. Seeing them blend together in Avengers and the sparks that resulted was the extra special treat. Example: They blended the grounded futurist (Tony Stark) with the Norse thunder god and his angry brother in a perfect way. Same could be said for every other character. It all works. In fact, it doesn't just fit, it's a symphony and that dyconomy and difference in characters are what makes it truly great. It's why this movie stands so tall above any other franchise at the moment. Things like Transformers, GI Joe and even Star Trek all operate with monotone restrictions. Avengers covers all angles and delivers depth with its fun.I haven't enjoyed a movie this much in years if not ever!","10","14 April 2012"
"saadgkhan","The Avengers – CATCH IT ( A+ ) The anticipation for the avenger's movie is undeniable. We have been waiting for this from years. To understand the Avenger's movie it's really important that you've seen all previous Ironman, the Incredible Hulk, Thor and Captain America's movies. As the avenger's give time to build characterizations for their heroes so getting into the avengers empty headed about hero's history will be foolish. The Avenger's brings back our beloved Marvel's heroes Tony Stark (Iron Man), Thor, Dr. Bruce Banner (Hulk), Steve Rogers (Captain America), Natasha Romanoff (Black Widow), Clint Barton (Hawkeye), Agent Maria Hill, Agent Phil Coulson and Director Nick Fury. Each hero's journey starts from where it ended in their respective movies. Now, The Avenger's stands strong in every department, from direction, production and performances. It won't be wrong to say that it brings out the best out of all the heroes. The humor, action and graphics are far brilliant than all the previous Marvel movies combined. The credit goes to generous brain of Joss Whedon. He brings out something very special out of each superhero. The interaction between all superheroes is something we don't see often, they tease, make fun and even fight with each other. Robert Downey Jr. (Ironman) is great as always. He brings his charming personality and wicked humor into his character which made him the superstar of today. Chris Hemsworth (Thor) is truly a god of thunder. His entry is as Big as Thor's entry should be, it makes you jump of your seat and cheer for him. Chris Evens (Captain America) is indeed the ultimate American Hero, he got the charm and personality of a true America hero. Some of the most standout moments in the movie belong to Mark Ruffalo (The Incredible Hulk). For the first time we see some humor in the actions of Hulk, he is just not a fury green monster this time around. besides Hulk, the biggest surprise is Scarlett Johansson (Black Widow), we have seen the part of her in Ironman movie but this time around we completely understand the strength and wickedness of Black Widow. She is absolutely stunning and fantastic. Jeremy Renner (Hawkeye) is good and I hope to see him someday with Black Widow. They had this amazing chemistry which requires further attention. Clark Gregg, Cobie Smulders and Samuel L. Jackson the S.H.E.I.L.D are fun to watch. Tom Hiddleston (Loki) is superb, he was the ultimate villain and considering his brilliant performance in Thor, he has out done himself again. Gwyneth Paltrow (Pepper Potts) appearance is appreciated and I would have loved to see Natalie Portman (Jane Foster) in it too. On the whole, The Avengers is the finest brilliant superhero movie of all time, it's filled with great performance, humor, action, graphics and brilliant direction. Highly recommended in 3D.","5","21 May 2012"
"biochemist","LA Review of 'The Avengers' (No spoilers)I was lucky enough to attend the Marvel screening of 'The Avengers' on Saturday morning in Century City, CA. This was an unusual screening as movies of this caliber are not screened some three weeks before it's release date. Just minutes before the movie started, we were all surprised when writer/director Joss Whedon walked in with Kevin Feige to introduced their little ""Justice League"" movie. Not only did we all laugh, but some booed. lol. If that wasn't enough of a surprise, the soft spoken Whedon introduced on stage Chris Hemsworth (Thor), Tom Hiddleston (Loki), Clark Gregg (Agent Coulson) and Cobie Smulders (Agent Maria Hill). Wow is she stunning in person! The audience gave them all a standing ovation with deafening cheers! (This explained why the secret service like security were searching, wanding everyone. No cameras, cell phones, nothing was allowed in.) What a nice surprise for an early Saturday morning screening. I've never read comic books. This is a comic book movie. It was made for hardcore fans of comics, and I appreciate the care Joss Whedon gives to this movie. It was very entertaining to see Tony Stark (Iron Man), Thor, Dr. Bruce Banner (Hulk), Steve Rogers (Captain America), Natasha Romanoff (Black Widow), Clint Barton (Hawkeye), Agent Maria Hill, Agent Phil Coulson and Director Nick Fury all interact with one another. Capt. Steve Rogers was fighting in WWII just yesterday. Having been recently awoken from his frozen sleep, he struggles to fit in our modern world with all this technology around us. The God of Thunder, Thor, is not from this world (realm) and doesn't understand modern technology on Earth as well. Dr. Bruce Banner has been on the run from the government, practicing medicine in third world countries. He hasn't been the Hulk in two years (What's his secret? ;). Tony Stark is still the same, playing with this high tech toys and inventing new technology. So how do you get them all to interact and play well together? Well, Director Joss Whedon is the secret to making it all work. The highlight of the film for me is how Joss Whedon has all these characters interact. Deep character development was not needed for this film. (That is what the respective movies are for: Thor, Iron Man, The Incredible Hulk, Captain America: The First Avenger) He does a great job of not forcing dialogue, and the interaction of the characters is much more organic than I would have ever anticipated. That is where Whedon deserves the most credit. He took what appears to be a very silly premise, with silly looking characters and made it completely work. Seeing as the Avengers comics date back to the 1960s, you can tell he not only did his homework, but he really cares deeply for the material, and his passion definitely shows on- screen. The movie is vastly entertaining. The Action scenes are amazing and satisfying. Nobody is short changed when it comes to the fighting or action sequences. I felt as if there was not a single bad performance. A couple of dialogue lines seemed off, but once you remember who the character is, and why they talk the way they do (think of where they come from), it all makes sense. Each respective character is true and honest to itself. Each of the characters brought their personality (from their respective movie) to the table. It is by far the best Marvel movie to date.So who was my personal favorite character from the movie? Dr. Bruce Banner (played by Mark Ruffalo) of course! He is by far the BEST Bruce Banner/Hulk since Bill Bixby. His intelligence (genius) is unparalleled (greater than Tony Stark's) and his compassion for human lives is what drives the good side of his character. As a kid growing up, he was my favorite Marvel super hero. I enjoyed watching Bill Bixby play medical doctor/physicist Dr. David Banner on television. I'd watch, terrified with my hands up to my face, as he transformed into the raging green hulk. Yet i was so fascinated with him being a scientist, helping those in need. When Mark Ruffalo was first announced to play Bruce Banner, i didn't know what to think of it. I knew that he's a good actor. All he needs is the right director to get the needed on-screen character out of him. I really hope they make an Incredible Hulk movie sequel starring Mark Ruffalo as Dr. Bruce Banner. Or at least, i vote for him to reprise his role in any sequel. He was a natural fit for this role. Overall, the best thing about these characters is that they are not silly twenty-something terrible actors who were chosen for on-screen eye candy. They all do a fine job of bringing these characters to life and their chemistry together works great. Assembled, they are unstoppable. When i heard an Avengers movie was rumored to be in the works, i was ecstatic. The day has finally come. Go see it. Thrice. 10/10 Stars.","9","16 April 2012"
"SPZMaxinema","This might be controversial to say but this is my personal favorite MCU movie. Up until this point, nothing had been done like this in film and it was executed magnificently. Going into this movie in 2012 (having only seen Iron Man beforehand) I was skeptical and not interested. Then my brother took us to the theater to see it and it was one hell of a blast. I was blown away and wanted to watch all of the other Phase 1 movies and learn more about these other heroes. The casting and chemistry between them is on point, the villain is compelling and gets under your skin in the best way, and Robert Downey Jr.'s humor all around is unforgettable, and how can I not mention that glorifying theme song?? Not to mention Stan Lee's perfect cameo!","10","21 August 2021"
"aidanratesmovies","It's a film that future generations will still be gushing about, much like previous generations did with such classics as Star Wars and Indiana Jones. It may not be perfect, but The Avengers lives up to its promise and delivers quite a punch. I feel The Avenger struggles as most superhero movies do with finding a way to naturally introduce its characters in a way that doesn't seem forced or formulaic. They do a decent job for what it is, but there are certain times you will feel the campiness of older works coming on as you view the film, and truly you just have to sit through it to get to the action that eventually will be at hand. Besides that though, there isn't many flaws. The acting is rather good, Samuel L. Jackson may take a line too seriously or too, but it's all in good fun. Again Tom Hiddleston as Loki is a major standout, and I also enjoyed the return of Robert Downey Jr.'s Iron Man and Chris Hemsworth Thor- as well as an improved performance by Chris Evans as Captain America and a great performance from replacement Hulk actor Mark Ruffalo. The action scenes are exciting and tense, there is some camera angles here and there that can be a bit annoying, but for the most part it is rather clear and not awfully tedious action- as many films of this type could be. In the end, despite its campiness and formulaic actions- The Avengers is an incredibly fun time. It takes pride in its stories and characters and makes the most out of an experience that could have easily been phoned in. Its a film that will live on for some time, and one i'm rather glad I got to experience first hand.My Rating: 9.4/10.","10","24 June 2021"
"ivo-cobra8","Marvel's The Avengers (2012) is an awesome descent MCU superhero action flick that is spectacular and a real good one. The first time I watched it on my computer I loved it. I have seen this movie many times in the row I have this film on DVD and Blu-ray. The movie features an ensemble cast that includes Robert Downey Jr., Chris Evans, Mark Ruffalo, Chris Hemsworth, Scarlett Johansson, Jeremy Renner, Tom Hiddleston, Clark Gregg, Cobie Smulders, Stellan Skarsgård, and Samuel L. Jackson. Joss Whedon did a fine job directing the film and I loved it is definitely in my top 10 favorite MCU superhero films. In the finale battle in New York the moment right there.. WILL NEVER... EVER.. BE AS COOL.. LIKE THIS WAS A COMIC MASTERPIECE.. I don't even read comics, but I did superheroes when I was younger.. I have a feeling justice league will never have this cohesion... this team work.. and will never be able to recreate this feeling.Robert Downey Jr. does a good job as a Iron Man he has a lot of good moments when he talks with Loki. In the third act he has to fight Thor that was cool then in the third act he had to do a lot of stuff, did the final stuff to safe the world. He is very much star of the film, that is why he number 1 star of the film he was payed a lot of more money then the other actors did ,but he deserved it he did a good job. Chris Evans as Captain America was spectacular I love his character I love how he defended and safe those people in the restaurant against Loki's army I thought that was descent. He does kick some ass when Thor hits him he uses his shield when SHIELD's ship was attacked he and Iron Man were trying to fix the ship I loved that. Mark Ruffalo was okay as The Hulk I thought he was better than Edward Norton's Hulk at least that is my opinion. Chris Hemsworth I liked him as Thor he was great. Scarlett Johansson as Black Widow was fantastic what does she do? She deals with the Hulk and Hawkeye the evil Hawkeye which I think is great. Jeremy Renner I like him a as an actor he is cool, he is mostly the bad guy in the film till the third act. In the third act he did a lot of cool stuff, he is cool with arrows. Loki he did fine the actor did fine as the villain I like him and Samuel L. Jackson as Nick Fury did fine. In the film, Nick Fury, director of the peacekeeping organization S.H.I.E.L.D., recruits Iron Man, Captain America, the Hulk, and Thor to form a team that must stop Thor's brother Loki from subjugating Earth.The pacing to me I thought it was little boring and it was too long but the third act was really was fast paced and the movie interested how 6 superheroes become a team who turn in to Avengers I think there was a lot of action scenes in the film that were really well done. I like special effect, I had a lot of fun scenes Hulk punching Thor or punching Loki when he said is emperor. That was fun, the film it self had a lot of action it self's. It was entertaining, the CGI was really good, Robert Downey Jr. had a lot funny moments and hilarious dialogues. I have more enjoyed Captain America because he cared more about people and of course Iron Man he saved the world from Loki's invaders. I thought it was an alright and I love it. It is definitely my favorite MARVEL superhero movie.Admittedly the first half or so isn't nearly as epic as the final 30 minutes. And the plot isn't that original. But I got what I paid for with this flick, Awesome action with Earth's Mightiest Heroes kicking alien ass.The Avengers in my honest opinion was better than Man of Steel because right next year DC superman movie come out that I have hated it and I wish I could have get the money back. I am going to try and sell the movie out. Marvel's The Avengers (classified under the name Marvel Avengers Assemble in the United Kingdom and Ireland), or simply The Avengers, is a 2012 American superhero film based on the Marvel Comics superhero team of the same name, produced by Marvel Studios and distributed by Walt Disney Studios Motion Pictures. It is the sixth film in the Marvel Cinematic Universe. The film was written and directed by Joss Whedon. I have reviewed 2 years the second movie twice and as a MARVEL fan I can say I have enjoyed this movie much more than Avengers: Age of Ultron. I am waiting now on Avengers: Infinity War and of course Spider-Man: Homecoming which is a spin off Captain America: Civil War like I said I have enjoy all three Captain America Films and I enjoy both Avenger films and I love Iron Man and Iron Man Three I am one of the fans that I liked that films. The rating I give is 10/10","9","2 July 2017"
